{
  "$schema": "https://raw.githubusercontent.com/furroxide/TopiaForge/main/schemas/topiaforge.mod.schema.json",
  "schemaVersion": 3,
  "name": "io.github.furroxide.topiaforge.prompts",
  "displayName": "TopiaForge Prompts",
  "version": "0.1.0",
  "author": {
    "name": "TopiaForge"
  },
  "description": "Framework SDK service for prompt override registration, deterministic effective override resolution, owner cleanup, disposable registrations, and conflict diagnostics.",
  "entryAssembly": "TopiaForge.Prompts.dll",
  "entryType": "TopiaForge.Prompts.PromptsMod",
  "vpmDependencies": {},
  "supportedGameVersionRange": "0.0.2227",
  "supportedLoaderVersionRange": ">=0.2.0 <0.3.0",
  "supportedSdkVersionRange": ">=0.1.0 <0.2.0",
  "category": "Framework",
  "tags": [
    "prompts",
    "overrides",
    "conflicts",
    "framework",
    "sdk"
  ],
  "license": "NOASSERTION",
  "permissions": [
    "prompt-overrides"
  ]
}
