{
  "$schema": "https://raw.githubusercontent.com/furroxide/TopiaForge/main/schemas/topiaforge.mod.schema.json",
  "schemaVersion": 3,
  "name": "io.github.furroxide.topiaforge.robotkit",
  "displayName": "TopiaForge RobotKit",
  "version": "0.8.0",
  "author": {
    "name": "TopiaForge"
  },
  "description": "Framework SDK service for spawning standard-agent robots that come up native (body, animation, native locomotion) and are driven by the game's own pathing, then overridden for behaviour and visuals. Also publishes a structured robot brain-query service, a multi-turn robot conversation service, a player dialogue-input service (typed text + push-to-talk voice via /agent/stt), and a robot objective service (persistent go-to/follow/patrol/wander/flee programs over named world targets, plus robot-to-robot reprogramming: a courier robot walks a payload program over to another robot and applies it on arrival, with a delivery event mods can react to) — the network services proxied through the game's own RoboAPI backend, mirroring how the base game lets you talk to robots.",
  "entryAssembly": "TopiaForge.RobotKit.dll",
  "entryType": "TopiaForge.RobotKit.RobotKitMod",
  "vpmDependencies": {},
  "supportedGameVersionRange": "0.0.2227",
  "supportedLoaderVersionRange": ">=0.2.0 <0.3.0",
  "supportedSdkVersionRange": ">=0.1.0 <0.2.0",
  "category": "Framework",
  "tags": [
    "robots",
    "agents",
    "navigation",
    "pathfinding",
    "sdk",
    "framework",
    "ai",
    "brain",
    "llm",
    "conversation",
    "voice",
    "stt",
    "objectives"
  ],
  "license": "NOASSERTION",
  "permissions": [
    "robot-spawning",
    "navigation",
    "physics",
    "network",
    "remote-ai",
    "player-token",
    "microphone",
    "speech-to-text"
  ]
}
