{
  "$schema": "https://raw.githubusercontent.com/furroxide/TopiaForge/main/schemas/topiaforge.mod.schema.json",
  "schemaVersion": 3,
  "name": "io.github.furroxide.topiaforge.assets",
  "displayName": "TopiaForge Assets",
  "version": "0.1.0",
  "author": {
    "name": "TopiaForge"
  },
  "description": "Framework SDK service for package-relative AssetBundle loading, typed asset lookup, prefab instantiation, asset-name listing, bundle caching, and per-mod cleanup.",
  "entryAssembly": "TopiaForge.Assets.dll",
  "entryType": "TopiaForge.Assets.AssetsMod",
  "vpmDependencies": {},
  "supportedGameVersionRange": "0.0.2227",
  "supportedLoaderVersionRange": ">=0.2.0 <0.3.0",
  "supportedSdkVersionRange": ">=0.1.0 <0.2.0",
  "category": "Framework",
  "tags": [
    "assets",
    "assetbundle",
    "prefab",
    "framework",
    "sdk"
  ],
  "license": "NOASSERTION",
  "permissions": [
    "asset-bundles",
    "filesystem"
  ]
}
