{
  "$schema": "https://raw.githubusercontent.com/furroxide/TopiaForge/main/schemas/topiaforge.mod.schema.json",
  "schemaVersion": 3,
  "name": "io.github.furroxide.topiaforge.uigallery",
  "displayName": "TopiaForge UI Gallery",
  "version": "0.2.0",
  "author": {
    "name": "TopiaForge"
  },
  "description": "Developer tool: a living catalog of every TopiaForgeUi widget in both brand schemes, with live high-contrast, UI-scale, and motion toggles. Toggle with F8. Not shipped in releases.",
  "entryAssembly": "TopiaForge.UiGallery.dll",
  "entryType": "TopiaForge.UiGallery.UiGalleryMod",
  "vpmDependencies": {},
  "supportedGameVersionRange": "0.0.2227",
  "supportedLoaderVersionRange": ">=0.2.0 <0.3.0",
  "supportedSdkVersionRange": ">=0.1.0 <0.2.0",
  "category": "DevTool",
  "tags": [
    "dev-only",
    "ui",
    "gallery",
    "sdk"
  ],
  "license": "NOASSERTION",
  "permissions": [
    "hud",
    "input"
  ]
}
